{
	"default": {
		"backgroundColor": "#F0F0F0",
		"borderColor": "#202020",
		"borderStyle": 1,
		"borderWidth": "0.5pt",
		"font": "Arial",
		"color": "#101010",
		"fontFamily": "Arial",
		"fontSize": "9pt",
		"padding": "2pt",
		"textAlign": 0
	},
	"table": {
		"borderWidth": "2pt",
		"borderColor": "#005810"
	},
	"rows": {
		"borderWidth": "1pt"
	},
	"cells": {
		"borderWidth": "0.2pt"
	},
	"header1": {
		"backgroundColor": "#336655",
		"color": "#F2F2F2",
		"fontSize": "14pt",
		"textAlign": 2
	},
	"header2": {
		"fontSize": "13pt",
		"color": "#F2F2F2",
		"backgroundColor": "#40806A",
		"textAlign": 2
	},
	"header3": {
		"fontSize": "12pt",
		"color": "#F2F2F2",
		"backgroundColor": "#4C987E",
		"textAlign": 2
	},
	"data": {
		"color": "#202020",
		"fontSize": "10pt"
	},
	"break1": {
		"fontSize": "14pt",
		"color": "#F2F2F2",
		"backgroundColor": "#336655",
		"textAlign": 1
	},
	"break2": {
		"fontSize": "13pt",
		"color": "#F2F2F2",
		"backgroundColor": "#40806A",
		"textAlign": 1
	},
	"break3": {
		"fontSize": "12pt",
		"color": "#F2F2F2",
		"backgroundColor": "#4C987E",
		"textAlign": 1
	},
	"bcor": {
		"backgroundColor": "#B7E5D6",
		"textAlign": 2,
		"fontSize": "10pt"
	}
}